<?xml version="1.0" encoding="UTF-8"?>
<apidoc
        xmlns:xsi="http://www.w3.org/2001/XMLSchema-instance"
        xsi:noNamespaceSchemaLocation="../apidoc.xsd">
    <appName>FakeVendor\FakeProject</appName>
    <scheme>app</scheme>
    <docDir>docs/md</docDir>
    <format>md</format>
    <title>Markdown API Docs</title>
    <links>
        <link rel="home" href="https://example.com" />
    </links>
</apidoc>
