<?xml version="1.0" encoding="UTF-8"?>
<apidoc
        xmlns:xsi="http://www.w3.org/2001/XMLSchema-instance"
        xsi:noNamespaceSchemaLocation="../apidoc.xsd">
    <appName>FakeVendor\FakeProject</appName>
    <scheme>app</scheme>
    <docDir>docs/html</docDir>
    <format>html</format>
    <title>API Doc Title</title>
    <description>This is the description of API Doc</description>
    <links>
        <link rel="doc" href="http://www.google.com/" />
        <link rel="foo" href="http://www.google.com/" />
    </links>
    <alps>alps.json</alps>
</apidoc>
