<?xml version="1.0" encoding="UTF-8"?>
<apidoc
        xmlns:xsi="http://www.w3.org/2001/XMLSchema-instance"
        xsi:noNamespaceSchemaLocation="../apidoc.xsd">
    <appName>FakeVendor\FakeProject</appName>
    <scheme>app</scheme>
    <docDir>../docs</docDir>
    <format>html</format>
    <title>API Doc Title</title>
    <description>This is the description of API Doc</description>
    <links>
        <link rel="home" href="https://github.com/bearsunday/BEAR.ApiDoc" />
        <link rel="issues" href="https://github.com/bearsunday/BEAR.ApiDoc/issues" />
        <link rel="profile" href="alps.html" />
        <link rel="openapi" href="openapi/" />
        <link rel="audit" href="audit.html" />
    </links>
    <alps>../docs/alps.json</alps>
</apidoc>
